{
  "kind": "block",
  "spec_version": "0.1",
  "id": "work-order-starter",
  "status": "example",
  "purpose": "Turn an approved decision into a bounded Work Order candidate without granting execution authority.",
  "inputs": ["source_record", "decision_record", "candidate_revision"],
  "outputs": ["work_order_candidate"],
  "authority": {
    "owner_role": "human-intent-owner",
    "allowed_actions": ["local_preview", "synthetic_validation"],
    "denied_actions": ["external_write", "credential_change", "self_promotion"],
    "expires_at": "2099-01-01T00:00:00Z"
  },
  "verification": {
    "success_conditions": ["target, action, revision, expiry, rollback, and stop conditions are bound"],
    "negative_tests": ["missing decision, unbound target, or drifted revision is rejected"],
    "receipt_required": true
  },
  "rollback": {
    "action": "discard the unpromoted local candidate",
    "verify": "Current Truth remains unchanged"
  },
  "stop_conditions": ["source drift", "authority expiry", "unexpected external effect"]
}
