{
  "kind": "block",
  "spec_version": "0.1",
  "id": "change-execution-starter",
  "status": "example",
  "purpose": "Produce a local or synthetic Change Candidate only when Work Order and Capability Grant candidates agree.",
  "inputs": ["work_order_candidate", "capability_grant_candidate", "candidate_revision"],
  "outputs": ["change_candidate"],
  "authority": {
    "owner_role": "execution-lane",
    "allowed_actions": ["local_preview", "synthetic_validation"],
    "denied_actions": ["unbound_external_write", "credential_permission_change", "self_promotion"],
    "expires_at": "2099-01-01T00:00:00Z"
  },
  "verification": {
    "success_conditions": ["Work Order, grant, target revision, produced artifacts, and observed effects remain exactly bound"],
    "negative_tests": ["missing grant, expired authority, revision drift, or unexpected effect fails closed"],
    "receipt_required": true
  },
  "rollback": {
    "action": "discard the local Change Candidate and apply the Work Order rollback if an effect occurred",
    "verify": "candidate artifacts and observed effects match the rollback receipt"
  },
  "stop_conditions": ["Work Order and grant mismatch", "candidate revision drift", "unexpected external effect"]
}
